{
  "created_at": "2026-06-24T22:40:57Z",
  "description": "Experiential is the open source, zero markup gateway for BYOK, self-hosted and 1000+ marketplace models. It learns from your traffic to cut costs, recommend better models, and train a specialized model you own.",
  "forks_count": 234,
  "has_discussions": false,
  "has_pages": false,
  "has_projects": true,
  "has_wiki": true,
  "homepage": "https://experientiallabs.ai",
  "is_template": false,
  "language": "Python",
  "languages": {
    "HTML": 9950,
    "Just": 959,
    "Python": 16953498,
    "Rust": 2883589
  },
  "last_synced_at": "2026-10-16T11:01:59Z",
  "last_synced_sha": "",
  "last_synced_status": "failed",
  "last_upstream_sha": "",
  "last_validated_at": "2026-10-16T11:59:11Z",
  "license_current_name": "Apache License 2.0",
  "license_current_spdx": "Apache-2.0",
  "license_history": [],
  "network_count": 234,
  "open_issues_count": 43,
  "private": "ionix-ray/experiential",
  "refreshed_at": "2026-10-16T11:01:59Z",
  "stargazers_count": 9571,
  "subscribers_count": 12,
  "topics": [],
  "updated_at": "2026-10-08T03:14:55Z",
  "upstream": "experientiallabs/experiential",
  "upstream_archived": false,
  "upstream_default_branch": "main",
  "upstream_pushed_at": "2026-10-08T00:17:59Z",
  "upstream_size_kb": 100286,
  "upstream_state": "deleted",
  "watchers_count": 12
}
