{
  "created_at": "2024-06-11T03:33:01Z",
  "description": "OpenAPI specification for the Portkey API",
  "forks_count": 7,
  "has_discussions": false,
  "has_pages": false,
  "has_projects": true,
  "has_wiki": false,
  "homepage": "https://portkey.ai/docs/api-reference/",
  "is_template": false,
  "language": "",
  "languages": {},
  "last_synced_at": "2026-10-26T12:33:40Z",
  "last_synced_sha": "c3dda8038580e40b53ae666b06167a2977146eaf",
  "last_synced_status": "ok",
  "last_upstream_sha": "c3dda8038580e40b53ae666b06167a2977146eaf",
  "license_current_name": "MIT License",
  "license_current_spdx": "MIT",
  "license_history": [],
  "network_count": 7,
  "open_issues_count": 1,
  "private": "ionix-ray/openapi",
  "refreshed_at": "2026-10-26T12:33:40Z",
  "stargazers_count": 7,
  "subscribers_count": 1,
  "topics": [
    "api-spec",
    "openai",
    "openapi",
    "portkey",
    "yaml",
    "ai-gateway"
  ],
  "updated_at": "2026-10-19T04:24:00Z",
  "upstream": "Portkey-AI/openapi",
  "upstream_archived": false,
  "upstream_default_branch": "master",
  "upstream_pushed_at": "2026-10-19T04:23:52Z",
  "upstream_size_kb": 1955,
  "upstream_state": "active",
  "watchers_count": 1
}
