{
  "created_at": "2026-04-29T21:12:19Z",
  "description": "A Python library for building AI agents that leverage the full power of Google Antigravity.",
  "forks_count": 1505,
  "has_discussions": true,
  "has_pages": false,
  "has_projects": true,
  "has_wiki": true,
  "homepage": "https://antigravity.google/product/antigravity-sdk",
  "is_template": false,
  "language": "Python",
  "languages": {
    "Python": 1630575,
    "Shell": 15342
  },
  "last_synced_at": "2026-10-21T11:26:52Z",
  "last_synced_sha": "91dc5f84565bb505577ac9524f107f453a6e8d1f",
  "last_synced_status": "ok",
  "last_upstream_sha": "91dc5f84565bb505577ac9524f107f453a6e8d1f",
  "license_current_name": "Apache License 2.0",
  "license_current_spdx": "Apache-2.0",
  "license_history": [],
  "network_count": 1505,
  "open_issues_count": 26,
  "private": "ionix-ray/antigravity-sdk-python",
  "refreshed_at": "2026-10-22T04:31:01Z",
  "stargazers_count": 3814,
  "subscribers_count": 168,
  "topics": [
    "ai-agents",
    "antigravity",
    "gemini",
    "gemini-api",
    "google",
    "llm-agents",
    "mcp",
    "python-sdk",
    "skills"
  ],
  "updated_at": "2026-10-21T22:58:48Z",
  "upstream": "google-antigravity/antigravity-sdk-python",
  "upstream_archived": false,
  "upstream_default_branch": "main",
  "upstream_pushed_at": "2026-10-13T22:48:33Z",
  "upstream_size_kb": 2292,
  "upstream_state": "active",
  "watchers_count": 168
}
