{
  "created_at": "2018-07-31T19:41:49Z",
  "description": ":bar_chart: :chart_with_upwards_trend:⠀Robust dataviz framework implemented using D3 & typescript",
  "forks_count": 220,
  "has_discussions": true,
  "has_pages": false,
  "has_projects": true,
  "has_wiki": true,
  "homepage": "https://charts.carbondesignsystem.com",
  "is_template": false,
  "language": "HTML",
  "languages": {
    "HTML": 61107872,
    "JavaScript": 10127,
    "SCSS": 68604,
    "Shell": 2699,
    "Svelte": 16387,
    "TypeScript": 2194745,
    "Vue": 710
  },
  "last_synced_at": "2026-10-26T12:33:23Z",
  "last_synced_sha": "d1b1061ab67b1b5c909f55afb3aabba7a0777391",
  "last_synced_status": "ok",
  "last_upstream_sha": "d1b1061ab67b1b5c909f55afb3aabba7a0777391",
  "last_validated_at": "",
  "license_current_name": "Apache License 2.0",
  "license_current_spdx": "Apache-2.0",
  "license_history": [],
  "network_count": 220,
  "open_issues_count": 269,
  "private": "ionix-ray/carbon-charts",
  "refreshed_at": "2026-10-26T12:33:23Z",
  "stargazers_count": 1055,
  "subscribers_count": 27,
  "topics": [
    "d3",
    "charts",
    "typescript",
    "d3js",
    "ibm",
    "carbon-design-system",
    "dataviz",
    "angular",
    "vue",
    "react",
    "vanilla",
    "hacktoberfest",
    "javascript",
    "svelte"
  ],
  "updated_at": "2026-10-21T10:54:57Z",
  "upstream": "carbon-design-system/carbon-charts",
  "upstream_archived": false,
  "upstream_default_branch": "main",
  "upstream_pushed_at": "2026-10-21T10:56:12Z",
  "upstream_size_kb": 1207919,
  "upstream_state": "active",
  "watchers_count": 27
}
