{
  "created_at": "2017-03-03T17:02:42Z",
  "description": "Qiskit is an open-source SDK for working with quantum computers at the level of extended quantum circuits, operators, and primitives.",
  "forks_count": 3074,
  "has_discussions": false,
  "has_pages": false,
  "has_projects": true,
  "has_wiki": true,
  "homepage": "https://www.ibm.com/quantum/qiskit",
  "is_template": false,
  "language": "Python",
  "languages": {
    "C": 491042,
    "C++": 1853,
    "CMake": 3603,
    "Jupyter Notebook": 1320,
    "Makefile": 6715,
    "OpenQASM": 22803,
    "Python": 13366952,
    "Rust": 6543108,
    "Shell": 17202
  },
  "last_synced_at": "2026-10-13T13:53:00Z",
  "last_synced_sha": "2d904815bc7fbba30f4162b79becece0817df674",
  "last_synced_status": "ok",
  "last_upstream_sha": "2d904815bc7fbba30f4162b79becece0817df674",
  "last_validated_at": "",
  "license_current_name": "Apache License 2.0",
  "license_current_spdx": "Apache-2.0",
  "license_history": [],
  "network_count": 3074,
  "open_issues_count": 724,
  "private": "ionix-ray/qiskit",
  "refreshed_at": "2026-10-13T13:53:00Z",
  "stargazers_count": 7871,
  "subscribers_count": 232,
  "topics": [
    "quantum-computing",
    "qiskit",
    "sdk",
    "quantum-programming-language",
    "quantum-circuit",
    "quantum",
    "python",
    "c",
    "rust"
  ],
  "updated_at": "2026-10-07T23:48:42Z",
  "upstream": "Qiskit/qiskit",
  "upstream_archived": false,
  "upstream_default_branch": "main",
  "upstream_pushed_at": "2026-10-08T01:56:49Z",
  "upstream_size_kb": 179423,
  "upstream_state": "active",
  "watchers_count": 232
}
