{
  "created_at": "2023-05-11T01:09:00Z",
  "description": "The Enterprise-Grade Multi-Agent Orchestration Framework. Website: https://swarms.ai",
  "forks_count": 1038,
  "has_discussions": true,
  "has_pages": false,
  "has_projects": true,
  "has_wiki": true,
  "homepage": "https://docs.swarms.world",
  "is_template": false,
  "language": "Python",
  "languages": {
    "Dockerfile": 1297,
    "PowerShell": 4574,
    "Python": 4228997,
    "Shell": 12651
  },
  "last_synced_at": "2026-10-12T14:54:24Z",
  "last_synced_sha": "e0c7445490151188b7f3d525b480947c121472ce",
  "last_synced_status": "ok",
  "last_upstream_sha": "e0c7445490151188b7f3d525b480947c121472ce",
  "license_current_name": "Apache License 2.0",
  "license_current_spdx": "Apache-2.0",
  "license_history": [],
  "network_count": 1038,
  "open_issues_count": 129,
  "private": "ionix-ray/swarms",
  "refreshed_at": "2026-10-12T14:54:24Z",
  "stargazers_count": 7234,
  "subscribers_count": 67,
  "topics": [
    "artificial-intelligence",
    "langchain",
    "machine-learning",
    "swarms",
    "agents",
    "prompt-engineering",
    "prompt-toolkit",
    "prompting",
    "tree-of-thoughts",
    "ai",
    "chatgpt",
    "gpt4all",
    "huggingface",
    "langchain-python",
    "agentic-workflow",
    "multi-agent-systems",
    "agentic-ai",
    "claude-code"
  ],
  "updated_at": "2026-10-07T22:57:46Z",
  "upstream": "kyegomez/swarms",
  "upstream_archived": false,
  "upstream_default_branch": "master",
  "upstream_pushed_at": "2026-10-07T21:56:48Z",
  "upstream_size_kb": 189378,
  "upstream_state": "active",
  "watchers_count": 67
}
