{
  "created_at": "2020-02-27T00:22:45Z",
  "description": "Instant Kubernetes-Native Application Observability",
  "forks_count": 507,
  "has_discussions": false,
  "has_pages": false,
  "has_projects": true,
  "has_wiki": true,
  "homepage": "https://px.dev",
  "is_template": false,
  "language": "C++",
  "languages": {
    "C": 331850,
    "C++": 9560051,
    "Dockerfile": 33909,
    "Go": 3949917,
    "Go Template": 17092,
    "HCL": 435,
    "HTML": 2145,
    "Java": 6717,
    "JavaScript": 39392,
    "Lua": 14391,
    "Makefile": 26564,
    "PHP": 40881,
    "PLpgSQL": 2809,
    "Python": 815805,
    "Ruby": 46053,
    "Scala": 2626,
    "Shell": 284663,
    "Starlark": 1111113,
    "Thrift": 498,
    "TypeScript": 1753038
  },
  "last_synced_at": "2026-10-31T11:56:31Z",
  "last_synced_sha": "50cabe70efeab51e69a20703f0f019114efc19be",
  "last_synced_status": "ok",
  "last_upstream_sha": "50cabe70efeab51e69a20703f0f019114efc19be",
  "last_validated_at": "",
  "license_current_name": "Apache License 2.0",
  "license_current_spdx": "Apache-2.0",
  "license_history": [],
  "network_count": 507,
  "open_issues_count": 303,
  "private": "ionix-ray/pixie",
  "refreshed_at": "2026-10-31T11:56:31Z",
  "stargazers_count": 6550,
  "subscribers_count": 75,
  "topics": [
    "golang",
    "kubernetes",
    "ebpf",
    "vega",
    "monitoring",
    "gke",
    "eks",
    "aks",
    "minikube",
    "machine-learning",
    "distributed-systems",
    "px-run",
    "pixie",
    "px",
    "cncf",
    "metrics",
    "observability",
    "cloud-native",
    "pandas",
    "apache-arrow"
  ],
  "updated_at": "2026-10-21T07:56:50Z",
  "upstream": "pixie-io/pixie",
  "upstream_archived": false,
  "upstream_default_branch": "main",
  "upstream_pushed_at": "2026-10-19T00:39:07Z",
  "upstream_size_kb": 121778,
  "upstream_state": "active",
  "watchers_count": 75
}
