{
  "created_at": "2026-08-27T14:04:34Z",
  "description": "Uzinele Întunecate (uzi): an AI dark factory",
  "forks_count": 4,
  "has_discussions": false,
  "has_pages": false,
  "has_projects": true,
  "has_wiki": false,
  "homepage": "",
  "is_template": false,
  "language": "Go",
  "languages": {
    "Awk": 5185,
    "CSS": 23761,
    "Dockerfile": 84752,
    "Go": 36703495,
    "Go Template": 48192,
    "HTML": 1548303,
    "JavaScript": 403433,
    "PLpgSQL": 208024,
    "Python": 396445,
    "Ruby": 17843,
    "Shell": 3684939,
    "TypeScript": 35740145,
    "jq": 4649
  },
  "last_synced_at": "2026-10-24T10:36:44Z",
  "last_synced_sha": "065a806a0c1437aa7bf815ec742783a79770f6d1",
  "last_synced_status": "ok",
  "last_upstream_sha": "065a806a0c1437aa7bf815ec742783a79770f6d1",
  "license_current_name": "MIT License",
  "license_current_spdx": "MIT",
  "license_history": [],
  "network_count": 4,
  "open_issues_count": 216,
  "private": "ionix-ray/uzi",
  "refreshed_at": "2026-10-24T10:36:44Z",
  "stargazers_count": 92,
  "subscribers_count": 1,
  "topics": [],
  "updated_at": "2026-10-22T03:10:05Z",
  "upstream": "vtmocanu/uzi",
  "upstream_archived": false,
  "upstream_default_branch": "main",
  "upstream_pushed_at": "2026-10-22T04:15:52Z",
  "upstream_size_kb": 96784,
  "upstream_state": "active",
  "watchers_count": 1
}
