{
  "created_at": "2026-05-10T08:44:44Z",
  "description": "belt — the cloud platform cli for ai agents",
  "forks_count": 0,
  "has_discussions": false,
  "has_pages": false,
  "has_projects": true,
  "has_wiki": true,
  "homepage": "",
  "is_template": false,
  "language": "Shell",
  "languages": {
    "PowerShell": 1967,
    "Shell": 3284
  },
  "last_synced_at": "2026-10-12T14:54:07Z",
  "last_synced_sha": "9736524264825acd558521646d20bc33873ad992",
  "last_synced_status": "ok",
  "last_upstream_sha": "9736524264825acd558521646d20bc33873ad992",
  "last_validated_at": "",
  "license_current_name": "MIT License",
  "license_current_spdx": "MIT",
  "license_history": [],
  "network_count": 0,
  "open_issues_count": 0,
  "private": "ionix-ray/cli",
  "refreshed_at": "2026-10-12T14:54:07Z",
  "stargazers_count": 7,
  "subscribers_count": 0,
  "topics": [],
  "updated_at": "2026-09-27T11:16:47Z",
  "upstream": "belt-sh/cli",
  "upstream_archived": false,
  "upstream_default_branch": "main",
  "upstream_pushed_at": "2026-09-27T11:16:43Z",
  "upstream_size_kb": 33,
  "upstream_state": "active",
  "watchers_count": 0
}
