{
  "created_at": "2018-09-13T19:18:50Z",
  "description": "A cross-platform, safe, pure-Rust graphics API.",
  "forks_count": 1557,
  "has_discussions": true,
  "has_pages": false,
  "has_projects": true,
  "has_wiki": true,
  "homepage": "https://wgpu.rs",
  "is_template": false,
  "language": "Rust",
  "languages": {
    "GLSL": 531038,
    "HLSL": 345988,
    "HTML": 702,
    "JavaScript": 31287,
    "Metal": 458731,
    "RenderScript": 2,
    "Rust": 12923618,
    "Shell": 2020,
    "Slang": 2422,
    "WGSL": 2202613
  },
  "last_synced_at": "2026-10-23T11:17:58Z",
  "last_synced_sha": "63e505290e82708a53b53eb8a16aec731683be63",
  "last_synced_status": "ok",
  "last_upstream_sha": "63e505290e82708a53b53eb8a16aec731683be63",
  "last_validated_at": "",
  "license_current_name": "Apache License 2.0",
  "license_current_spdx": "Apache-2.0",
  "license_history": [],
  "network_count": 1557,
  "open_issues_count": 1178,
  "private": "ionix-ray/wgpu",
  "refreshed_at": "2026-10-23T11:17:58Z",
  "stargazers_count": 18346,
  "subscribers_count": 117,
  "topics": [
    "webgpu",
    "rust",
    "gpu",
    "metal",
    "opengl",
    "vulkan",
    "hacktoberfest",
    "d3d12"
  ],
  "updated_at": "2026-10-22T02:00:12Z",
  "upstream": "gfx-rs/wgpu",
  "upstream_archived": false,
  "upstream_default_branch": "trunk",
  "upstream_pushed_at": "2026-10-22T00:15:33Z",
  "upstream_size_kb": 87831,
  "upstream_state": "active",
  "watchers_count": 117
}
