{
  "created_at": "2026-04-14T00:51:32Z",
  "description": "Reverse engineer anything with agents, from app behavior down to native binaries.",
  "forks_count": 90163,
  "has_discussions": true,
  "has_pages": false,
  "has_projects": true,
  "has_wiki": false,
  "homepage": "https://rea.tools",
  "is_template": false,
  "language": "TypeScript",
  "languages": {
    "Assembly": 7479,
    "C": 27736,
    "C++": 109686,
    "CSS": 56798,
    "Go Template": 7196,
    "HTML": 730230,
    "Java": 421256,
    "JavaScript": 3056963,
    "Linker Script": 692,
    "Makefile": 250,
    "Objective-C": 3047,
    "Python": 798306,
    "Shell": 12663,
    "Solidity": 470,
    "Swift": 54283,
    "TypeScript": 34226682
  },
  "last_synced_at": "2026-10-28T12:26:35Z",
  "last_synced_sha": "ac545adae21893828d20aec31f098f6533e2ed0d",
  "last_synced_status": "ok",
  "last_upstream_sha": "ac545adae21893828d20aec31f098f6533e2ed0d",
  "license_current_name": "MIT License",
  "license_current_spdx": "MIT",
  "license_history": [],
  "network_count": 90163,
  "open_issues_count": 988,
  "private": "ionix-ray/rea",
  "refreshed_at": "2026-10-28T12:26:35Z",
  "stargazers_count": 359211,
  "subscribers_count": 1276,
  "topics": [
    "ai-agents",
    "binary-analysis",
    "cli",
    "decompiler",
    "mcp",
    "model-context-protocol",
    "reverse-engineering",
    "static-analysis",
    "agent-skills",
    "dsh-plugin",
    "cordis",
    "dsh",
    "hopper",
    "ghidra",
    "claude-code",
    "codex",
    "developer-tools",
    "llm",
    "rea",
    "touhou"
  ],
  "updated_at": "2026-10-22T04:30:50Z",
  "upstream": "morluto/rea",
  "upstream_archived": false,
  "upstream_default_branch": "main",
  "upstream_pushed_at": "2026-10-22T04:28:17Z",
  "upstream_size_kb": 96668,
  "upstream_state": "active",
  "watchers_count": 1276
}
