{
  "created_at": "2026-10-21T03:31:18Z",
  "description": "🔓 An AI web-pentest skill for Claude Code. Point it at a site you're authorized to test — it maps the attack surface, works through the OWASP WSTG, validates findings, and writes dev + stakeholder reports (PDF).",
  "forks_count": 3,
  "has_discussions": false,
  "has_pages": false,
  "has_projects": true,
  "has_wiki": true,
  "homepage": "",
  "is_template": false,
  "language": "HTML",
  "languages": {
    "HTML": 9332,
    "Shell": 3606
  },
  "last_synced_at": "2026-10-28T12:26:23Z",
  "last_synced_sha": "5a5600568ba722dac10744d50da92bef08733b6e",
  "last_synced_status": "ok",
  "last_upstream_sha": "5a5600568ba722dac10744d50da92bef08733b6e",
  "license_current_name": "Other",
  "license_current_spdx": "OTHER",
  "license_history": [],
  "network_count": 3,
  "open_issues_count": 0,
  "private": "ionix-ray/open-sesame",
  "refreshed_at": "2026-10-28T12:26:23Z",
  "stargazers_count": 19,
  "subscribers_count": 0,
  "topics": [
    "ai-agents",
    "anthropic",
    "appsec",
    "claude",
    "claude-code",
    "ethical-hacking",
    "infosec",
    "owasp",
    "owasp-wstg",
    "penetration-testing",
    "pentesting",
    "security",
    "security-tools",
    "vulnerability-assessment",
    "web-security"
  ],
  "updated_at": "2026-10-22T03:12:02Z",
  "upstream": "hassan-algo/open-sesame",
  "upstream_archived": false,
  "upstream_default_branch": "main",
  "upstream_pushed_at": "2026-10-21T19:28:58Z",
  "upstream_size_kb": 35,
  "upstream_state": "active",
  "watchers_count": 0
}
