{
  "created_at": "2018-03-07T05:14:12Z",
  "description": "GyoiThon is a growing penetration test tool using Machine Learning.",
  "forks_count": 306,
  "has_discussions": false,
  "has_pages": false,
  "has_projects": true,
  "has_wiki": true,
  "homepage": "",
  "is_template": false,
  "language": "Python",
  "languages": {
    "Dockerfile": 1137,
    "HTML": 2535,
    "Python": 322956,
    "Shell": 775
  },
  "last_synced_at": "2026-10-24T10:36:09Z",
  "last_synced_sha": "8dec26aabdbf9ee999e7cc5b5eee9222f01bae13",
  "last_synced_status": "ok",
  "last_upstream_sha": "8dec26aabdbf9ee999e7cc5b5eee9222f01bae13",
  "license_current_name": "Other",
  "license_current_spdx": "OTHER",
  "license_history": [],
  "network_count": 306,
  "open_issues_count": 17,
  "private": "ionix-ray/GyoiThon",
  "refreshed_at": "2026-10-24T10:36:09Z",
  "stargazers_count": 832,
  "subscribers_count": 65,
  "topics": [],
  "updated_at": "2026-10-22T01:19:56Z",
  "upstream": "gyoisamurai/GyoiThon",
  "upstream_archived": false,
  "upstream_default_branch": "master",
  "upstream_pushed_at": "2023-04-21T13:13:38Z",
  "upstream_size_kb": 3709,
  "upstream_state": "active",
  "watchers_count": 65
}
