{
  "created_at": "2026-06-21T08:38:06Z",
  "description": "The Autonomous Bug-Bounty Swarm  A school of 53 specialized AI security agents + a deterministic engagement router that classify any target and strip it to the bone — in parallel.",
  "forks_count": 10,
  "has_discussions": false,
  "has_pages": false,
  "has_projects": true,
  "has_wiki": true,
  "homepage": "",
  "is_template": false,
  "language": "TypeScript",
  "languages": {
    "PowerShell": 4385,
    "Shell": 7419,
    "TypeScript": 143668
  },
  "last_synced_at": "2026-10-11T12:24:29Z",
  "last_synced_sha": "0f66391e19a145bee85763c2636e46322f96d1de",
  "last_synced_status": "ok",
  "last_upstream_sha": "0f66391e19a145bee85763c2636e46322f96d1de",
  "last_validated_at": "",
  "license_current_name": "MIT License",
  "license_current_spdx": "MIT",
  "license_history": [],
  "network_count": 10,
  "open_issues_count": 0,
  "private": "ionix-ray/PiRanha",
  "refreshed_at": "2026-10-11T12:24:29Z",
  "stargazers_count": 5,
  "subscribers_count": 0,
  "topics": [],
  "updated_at": "2026-08-18T09:22:06Z",
  "upstream": "Falcon-Forge/PiRanha",
  "upstream_archived": false,
  "upstream_default_branch": "main",
  "upstream_pushed_at": "2026-06-20T23:53:54Z",
  "upstream_size_kb": 782,
  "upstream_state": "active",
  "watchers_count": 0
}
