{
  "last_synced_at": "2026-10-14T11:30:27Z",
  "last_synced_sha": "",
  "last_synced_status": "failed",
  "last_upstream_sha": "",
  "last_validated_at": "2026-10-14T12:32:17Z",
  "private": "ionix-ray/experiential-enterprise",
  "refreshed_at": "2026-10-14T11:30:27Z",
  "upstream": "experientiallabs/experiential-enterprise",
  "upstream_state": "deleted"
}
