{
  "created_at": "2025-03-19T07:21:26Z",
  "description": "Fastest enterprise AI gateway (50x faster than LiteLLM) with adaptive load balancer, cluster mode, guardrails, 1000+ models support & <100 µs overhead at 5k RPS.",
  "forks_count": 1354,
  "has_discussions": true,
  "has_pages": false,
  "has_projects": false,
  "has_wiki": false,
  "homepage": "https://www.getmaxim.ai/bifrost",
  "is_template": false,
  "language": "Go",
  "languages": {
    "CSS": 24928,
    "Dockerfile": 4537,
    "Go": 40269351,
    "Go Template": 133880,
    "HCL": 205286,
    "HTML": 7359,
    "JavaScript": 1325385,
    "Makefile": 242562,
    "Nix": 12770,
    "Python": 1283694,
    "Shell": 393582,
    "TypeScript": 7194377,
    "jq": 6318
  },
  "last_synced_at": "2026-10-12T14:53:43Z",
  "last_synced_sha": "1e7d1ee6f0514e70bffaaf92edccd941eb0f31af",
  "last_synced_status": "ok",
  "last_upstream_sha": "1e7d1ee6f0514e70bffaaf92edccd941eb0f31af",
  "license_current_name": "Apache License 2.0",
  "license_current_spdx": "Apache-2.0",
  "license_history": [],
  "network_count": 1354,
  "open_issues_count": 522,
  "private": "ionix-ray/bifrost",
  "refreshed_at": "2026-10-12T14:53:43Z",
  "stargazers_count": 8619,
  "subscribers_count": 35,
  "topics": [
    "gateway",
    "llm",
    "llm-gateway",
    "mcp-client",
    "mcp-server",
    "guardrails",
    "mcp-gateway",
    "ai-gateway",
    "gateway-services",
    "generative-ai",
    "llm-cost",
    "llm-observability",
    "llmops",
    "load-balancing",
    "token-management",
    "model-router"
  ],
  "updated_at": "2026-10-08T03:15:58Z",
  "upstream": "maximhq/bifrost",
  "upstream_archived": false,
  "upstream_default_branch": "dev",
  "upstream_pushed_at": "2026-10-07T21:30:12Z",
  "upstream_size_kb": 1028851,
  "upstream_state": "active",
  "watchers_count": 35
}
